subreddit,half_year,cluster,top_10_unigrams,top_10_bigrams
lonely,2020-1,0,"lonely, want, people, alone, friend, like, anyone, feel, day, someone","wan na, feel like, anyone else, feel lonely, gon na, valentine day, year old, new year, feeling lonely, http http"
lonely,2020-1,1,"feel, like, people, know, want, life, even, really, never, one","feel like, feel alone, feel lonely, make feel, even though, anyone else, felt like, still feel, wan na, like one"
lonely,2020-1,2,"birthday, today, happy, friend, feel, day, celebrate, alone, care, people","happy birthday, today birthday, birthday today, birthday feel, birthday coming, wished happy, wish happy, feel like, birthday alone, birthday party"
lonely,2020-1,3,"friend, people, school, like, feel, one, really, make, talk, time","best friend, feel like, make friend, high school, new friend, friend group, close friend, group friend, want friend, making friend"
lonely,2020-1,4,"talk, someone, want, need, anyone, lonely, feel, please, friend, wan","someone talk, need someone, want talk, wan na, want someone, anyone want, na talk, talk someone, anyone talk, looking someone"
socialanxiety,2018-1,0,"job, interview, anxiety, get, work, first, got, time, know, social","job interview, social anxiety, first job, get job, new job, need job, got job, feel like, getting job, time job"
socialanxiety,2018-1,1,"like, feel, people, know, talk, even, think, get, really, want","feel like, social anxiety, anyone else, make feel, talk people, talking people, eye contact, around people, even though, felt like"
socialanxiety,2018-1,2,"class, get, people, like, know, go, time, anyone, going, feel","anyone else, feel like, eye contact, social anxiety, first time, wan na, gon na, panic attack, every time, go back"
socialanxiety,2018-1,3,"anxiety, social, anyone, people, help, like, get, year, life, would","social anxiety, anyone else, social situation, anxiety disorder, feel like, social medium, anxiety social, social interaction, people social, social skill"
socialanxiety,2018-1,4,"friend, people, like, really, want, school, know, feel, one, group","feel like, high school, make friend, social anxiety, best friend, new friend, group friend, one friend, close friend, talk people"
healthanxiety,2019-2,0,"http, gt, keto, amp, cream, cbd, x200b, testo, enhancement, slim","http http, gt gt, amp x200b, gt http, http amp, male enhancement, cbd oil, click gt, x200b click, alpha testo"
healthanxiety,2019-2,1,"heart, chest, attack, anxiety, pain, palpitation, rate, feel, get, like","heart attack, heart rate, chest pain, heart palpitation, heart beat, panic attack, feel like, blood pressure, heart problem, heart disease"
healthanxiety,2019-2,2,"pain, feel, side, neck, left, head, like, lump, right, node","lymph node, feel like, left side, right side, anyone else, swollen lymph, side neck, week ago, go away, pain left"
healthanxiety,2019-2,3,"anxiety, health, like, feel, symptom, get, year, time, know, going","health anxiety, feel like, panic attack, anyone else, mental health, brain tumor, even though, month ago, year ago, going die"
healthanxiety,2019-2,4,"like, get, day, blood, know, worried, week, feel, got, doctor","anyone else, feel like, year old, blood test, health anxiety, last night, month ago, please help, panic attack, came back"
suicidewatch,2020-1,0,"help, please, need, someone, talk, know, want, anyone, really, friend","please help, need help, someone talk, need someone, help please, someone please, talk someone, really need, need talk, someone help"
suicidewatch,2020-1,1,"feel, like, know, life, want, time, get, even, friend, would","feel like, get better, every day, year old, year ago, suicidal thought, even though, make feel, want die, gon na"
suicidewatch,2020-1,2,"im, dont, cant, want, ive, feel, like, know, life, anymore","dont know, dont want, feel like, im going, im tired, wan na, like im, gon na, im scared, im gon"
suicidewatch,2020-1,3,"want, die, fucking, anymore, life, hate, feel, know, like, tired","want die, feel like, want live, want end, want kill, wan na, die want, anymore want, really want, want go"
suicidewatch,2020-1,4,"life, suicide, know, get, like, going, kill, year, would, feel","gon na, feel like, wan na, commit suicide, suicidal thought, get better, year old, anyone else, mental health, want die"
bipolarreddit,2019-1,0,"amp, x200b, http, med, time, help, know, bipolar, like, feel","amp x200b, http http, x200b http, http amp, feel like, x200b thanks, x200b know, x200b anyone, bipolar amp, med amp"
bipolarreddit,2019-1,1,"like, get, want, know, anyone, time, day, need, people, feel","anyone else, mental health, manic episode, feel like, hard time, mental illness, credit card, feeling like, last night, pretty much"
bipolarreddit,2019-1,2,"bipolar, disorder, mood, depression, work, anyone, year, diagnosed, episode, anxiety","bipolar disorder, diagnosed bipolar, anyone else, manic episode, mood swing, mood stabilizer, year ago, bipolar depression, bipolar ii, anyone experience"
bipolarreddit,2019-1,3,"feel, like, get, really, time, know, want, year, life, going","feel like, manic episode, depressive episode, first time, even though, year ago, felt like, diagnosed bipolar, year old, anyone else"
bipolarreddit,2019-1,4,"lamictal, lithium, latuda, taking, effect, experience, abilify, anyone, seroquel, side","side effect, anyone experience, anyone else, started taking, weight gain, feel like, go away, taking lithium, withdrawal symptom, else experienced"
addiction,2018-1,0,"addiction, help, http, addicted, want, take, would, need, day, anyone","need help, cold turkey, social medium, recovering addict, substance abuse, alcohol addiction, mental health, really love, want know, pretty much"
addiction,2018-1,1,"porn, addiction, video, phone, computer, addicted, website, sugar, class, think","porn addiction, might problem, gray area, become addicted, discord server, watch porn, via email, addiction addictive, addicted porn, addicted opiate"
addiction,2018-1,2,"know, get, time, year, want, like, life, drug, feel, go","feel like, year old, year ago, make feel, month ago, go back, every day, get clean, last year, need help"
addiction,2018-1,3,"looking, people, day, clean, anyone, drink, struggling, year, free, addiction","missed opportunity, day clean, anyone looking, energy drink, ever done, meet friend, looking help, mukti kendra, nasha mukti, neuroscience addiction"
addiction,2018-1,4,"smoking, weed, day, feel, like, smoke, adderall, cigarette, time, know","feel like, smoking weed, smoking cigarette, anyone else, smoke weed, quit smoking, panic attack, every night, first time, chest pain"
ptsd,2019-2,0,"people, trigger, like, anyone, know, trauma, time, get, thing, http","panic attack, anyone else, http http, feel like, year ago, 4th july, loud noise, gon na, need help, amp x200b"
ptsd,2019-2,1,"feel, like, know, feeling, really, ptsd, want, get, anyone, make","feel like, anyone else, make feel, like feel, diagnosed ptsd, feeling like, make sense, really like, else feel, time feel"
ptsd,2019-2,2,"know, like, time, year, feel, get, would, want, even, really","feel like, year ago, panic attack, year old, amp x200b, felt like, even though, first time, go back, get better"
ptsd,2019-2,3,"sleep, nightmare, dream, night, wake, like, day, get, anyone, every","night terror, every night, last night, anyone else, get sleep, panic attack, sleep nightmare, go sleep, hour sleep, dream night"
ptsd,2019-2,4,"ptsd, symptom, year, help, anyone, know, therapist, diagnosed, anxiety, experience","anyone else, diagnosed ptsd, panic attack, year ago, ptsd symptom, mental health, traumatic event, feel like, complex ptsd, anxiety depression"
anxiety,2020-1,0,"im, dont, cant, anxiety, feel, like, ive, know, get, really","dont know, im scared, like im, feel like, im going, im really, gon na, know im, think im, im afraid"
anxiety,2020-1,1,"feel, like, anxiety, know, get, want, time, really, people, thing","feel like, anyone else, make feel, even though, feeling like, social anxiety, gon na, every time, panic attack, felt like"
anxiety,2020-1,2,"anxiety, anyone, get, help, day, like, time, know, feel, else","anyone else, feel like, side effect, mental health, social anxiety, anxiety attack, http http, anxiety depression, panic attack, help anxiety"
anxiety,2020-1,3,"attack, panic, anxiety, like, heart, feel, get, day, really, feeling","panic attack, anxiety attack, feel like, anyone else, heart attack, heart rate, felt like, anxiety panic, chest pain, attack feel"
anxiety,2020-1,4,"job, work, anxiety, get, feel, time, new, interview, like, day","new job, feel like, get job, job interview, panic attack, go work, full time, mental health, part time, go back"
lonely,2019-1,0,"amp, x200b, http, discord, server, people, friend, feel, like, lonely","amp x200b, discord server, http http, http amp, x200b amp, feel like, x200b http, friend amp, lonely people, last year"
lonely,2019-1,1,"lonely, alone, feel, like, want, people, life, day, get, know","feel like, feel lonely, anyone else, valentine day, feeling lonely, gon na, year old, wan na, video game, wish could"
lonely,2019-1,2,"feel, like, people, know, really, want, friend, even, someone, one","feel like, feel lonely, make feel, feel alone, even though, want someone, still feel, anyone else, felt like, find someone"
lonely,2019-1,3,"friend, year, school, like, people, really, time, one, feel, make","best friend, make friend, high school, feel like, close friend, new friend, year ago, friend friend, friend group, group friend"
lonely,2019-1,4,"talk, someone, want, anyone, chat, need, lonely, looking, friend, wan","someone talk, wan na, want talk, anyone want, need someone, want someone, talk someone, looking someone, anyone wan, people talk"
healthanxiety,2019-1,0,"anyone, get, like, http, feel, else, know, worried, anxiety, day","anyone else, amp x200b, health anxiety, feel like, http http, gon na, day ago, every time, month ago, year old"
healthanxiety,2019-1,1,"node, lymph, neck, swollen, lump, side, lymphoma, feel, symptom, right","lymph node, swollen lymph, node neck, side neck, back neck, left side, week ago, behind ear, gon na, health anxiety"
healthanxiety,2019-1,2,"anxiety, health, like, feel, cancer, symptom, doctor, know, year, time","health anxiety, feel like, amp x200b, panic attack, last year, year old, colon cancer, anyone else, came back, month ago"
healthanxiety,2019-1,3,"heart, chest, attack, pain, feel, rate, anxiety, panic, palpitation, like","heart rate, heart attack, panic attack, chest pain, heart palpitation, feel like, shortness breath, came back, anyone else, like heart"
healthanxiety,2019-1,4,"pain, eye, left, head, feel, like, side, back, right, headache","feel like, left side, anyone else, brain tumor, right side, back pain, blood clot, week ago, go away, side head"
ptsd,2019-1,0,"feel, like, know, feeling, want, thing, people, make, get, time","feel like, anyone else, make feel, make sense, feeling like, year ago, feel safe, even though, panic attack, felt like"
ptsd,2019-1,1,"year, time, know, get, like, day, ptsd, really, thing, feel","feel like, year ago, panic attack, year old, first time, even though, month ago, last year, diagnosed ptsd, mental health"
ptsd,2019-1,2,"amp, x200b, ptsd, feel, like, year, http, get, time, know","amp x200b, x200b amp, http http, http amp, feel like, year ago, trigger warning, diagnosed ptsd, x200b also, x200b anyone"
ptsd,2019-1,3,"nightmare, sleep, night, dream, wake, prazosin, every, anyone, ptsd, bed","night terror, anyone else, last night, every night, fall asleep, panic attack, go sleep, prazosin nightmare, feel like, stop nightmare"
ptsd,2019-1,4,"ptsd, anyone, help, get, trauma, know, like, time, really, year","anyone else, diagnosed ptsd, panic attack, wondering anyone, anyone experience, year ago, first time, feel like, need help, http http"
adhd,2018-1,0,"like, feel, thing, get, time, work, know, really, adhd, even","feel like, high school, tl dr, even though, make feel, anyone else, thing like, year ago, every day, diagnosed adhd"
adhd,2018-1,1,"adhd, medication, diagnosed, doctor, get, diagnosis, psychiatrist, year, like, appointment","diagnosed adhd, year old, feel like, adhd medication, tl dr, adult adhd, get diagnosed, year ago, adhd diagnosis, people adhd"
adhd,2018-1,2,"adderall, xr, day, feel, taking, ir, like, take, doctor, medication","adderall xr, taking adderall, adderall ir, feel like, side effect, anyone else, take adderall, generic adderall, prescribed adderall, 20 mg"
adhd,2018-1,3,"vyvanse, med, take, taking, concerta, day, effect, ritalin, medication, feel","side effect, feel like, take med, anyone else, taking med, adhd med, started taking, first time, taking vyvanse, taking medication"
adhd,2018-1,4,"adhd, like, get, thing, time, work, day, anyone, one, help","anyone else, feel like, gon na, tl dr, get distracted, anyone tip, wondering anyone, every time, last night, adhd med"
depression,2020-1,0,"depression, help, feel, get, like, know, day, life, time, anyone","feel like, anyone else, mental health, wan na, gon na, side effect, amp x200b, need help, depression anxiety, get better"
depression,2020-1,1,"im, dont, cant, feel, like, ive, want, know, life, really","dont know, dont want, feel like, like im, im tired, im going, wan na, know im, think im, gon na"
depression,2020-1,2,"want, fucking, hate, life, die, know, tired, ca, anymore, people","want die, wan na, feel like, want live, want kill, gon na, fucking hate, really want, hate life, get better"
depression,2020-1,3,"year, friend, like, time, know, get, life, feel, really, even","feel like, high school, year ago, year old, last year, every day, best friend, mental health, get better, even though"
depression,2020-1,4,"feel, like, know, want, feeling, people, even, really, life, make","feel like, make feel, feeling like, feel way, anyone else, feel alone, feel empty, feel better, know feel, want feel"
suicidewatch,2019-1,0,"want, life, suicide, know, kill, help, would, think, need, someone","gon na, wan na, want die, feel like, commit suicide, anyone else, please help, suicidal thought, need help, someone talk"
suicidewatch,2019-1,1,"im, dont, cant, ive, want, like, know, feel, life, fucking","dont know, dont want, im going, feel like, im tired, gon na, like im, wan na, im gon, know im"
suicidewatch,2019-1,2,"amp, x200b, want, feel, like, life, know, people, get, would","amp x200b, x200b amp, feel like, http amp, x200b want, want die, x200b know, life amp, every day, x200b feel"
suicidewatch,2019-1,3,"life, year, get, know, like, time, friend, feel, even, would","feel like, get better, year old, year ago, every day, high school, suicidal thought, last year, best friend, gon na"
suicidewatch,2019-1,4,"want, feel, like, know, die, life, anymore, people, ca, even","feel like, want die, want live, want end, want kill, make feel, really want, die want, want feel, anymore want"
healthanxiety,2018-2,0,"tingling, earlobe, hiccup, pin, needle, last, weird, day, stiff, anxiety","coping mechanism, pin needle, hiccup week, needle feeling, last day, really weird, day idea, like hundred, tingling last, doctor totally"
healthanxiety,2018-2,1,"like, anxiety, get, feel, time, know, day, health, doctor, would","health anxiety, feel like, amp x200b, anyone else, month ago, day ago, year ago, lymph node, even though, anyone know"
healthanxiety,2018-2,2,"test, result, month, cancer, back, blood, got, anxiety, mental, one","blood test, mental health, waiting result, year old, gilbert syndrome, came back, amp x200b, upper arm, setting exact, medication work"
healthanxiety,2018-2,3,"pain, right, side, left, flu, headache, hurt, cancer, neck, back","lymph node, right side, left side, feel like, back pain, last night, health anxiety, chest pain, hard lump, doctor said"
healthanxiety,2018-2,4,"heart, attack, anxiety, feel, like, know, time, health, feeling, rate","heart attack, heart rate, health anxiety, panic attack, feel like, anyone else, year old, going die, hey guy, anxiety attack"
anxiety,2019-2,0,"job, work, interview, anxiety, new, get, feel, day, time, like","new job, job interview, feel like, first job, get job, panic attack, started new, got job, quit job, time job"
anxiety,2019-2,1,"feel, like, anxiety, feeling, get, know, really, day, anxious, something","feel like, anyone else, make feel, feeling like, like going, else feel, feel anxious, felt like, anxiety feel, even though"
anxiety,2019-2,2,"anxiety, anyone, get, help, day, know, like, time, else, anxious","anyone else, feel like, side effect, amp x200b, social anxiety, mental health, panic attack, anxiety depression, anxiety disorder, anxiety attack"
anxiety,2019-2,3,"attack, panic, anxiety, like, feel, get, day, heart, time, anyone","panic attack, anxiety attack, anyone else, feel like, anxiety panic, heart attack, get panic, felt like, year ago, heart rate"
anxiety,2019-2,4,"friend, people, like, know, want, anxiety, really, get, feel, time","feel like, social anxiety, even though, high school, gon na, year ago, amp x200b, panic attack, best friend, first time"
EDAnonymous,2019-1,0,"weight, lose, pound, gain, like, back, gained, lb, lost, month","lose weight, gain weight, weight loss, feel like, lost weight, weight gain, losing weight, water weight, gaining weight, gained weight"
EDAnonymous,2019-1,1,"like, anyone, ed, know, get, else, one, people, peach, feel","anyone else, feel like, eating disorder, gon na, look like, wan na, first time, anyone know, last night, mental health"
EDAnonymous,2019-1,2,"amp, x200b, http, food, like, feel, eating, weight, get, time","amp x200b, http http, amp amp, http amp, anyone else, feel like, x200b amp, eating disorder, lose weight, anorexia nervosa"
EDAnonymous,2019-1,3,"eat, food, calorie, day, like, binge, eating, feel, today, ate","feel like, gon na, wan na, anyone else, want eat, safe food, every day, many calorie, last night, binge food"
EDAnonymous,2019-1,4,"feel, like, want, know, eating, even, really, time, eat, weight","feel like, eating disorder, make feel, even though, lose weight, look like, anyone else, first time, every time, gon na"
autism,2019-1,0,"school, help, get, year, son, job, need, want, time, would","year old, high school, high functioning, need help, feel like, old son, want help, need advice, please help, last year"
autism,2019-1,1,"like, autistic, anyone, autism, one, get, thing, know, else, people","anyone else, year old, feel like, autistic people, weighted blanket, http http, sensory issue, high functioning, sensory overload, video game"
autism,2019-1,2,"amp, x200b, http, autism, like, people, would, know, help, get","amp x200b, http http, http amp, amp amp, x200b http, x200b amp, people autism, would like, year old, feel like"
autism,2019-1,3,"autism, child, adult, would, diagnosis, diagnosed, autistic, parent, know, http","http http, autism spectrum, child autism, autistic child, year old, aba therapy, diagnosed autism, spectrum disorder, autism diagnosis, would like"
autism,2019-1,4,"like, people, autism, feel, really, know, thing, autistic, think, friend","feel like, autistic people, eye contact, anyone else, high functioning, people autism, thing like, year old, hard time, functioning autism"
ptsd,2020-1,0,"people, get, like, ptsd, time, know, year, anyone, really, want","anyone else, mental health, http http, feel like, year ago, panic attack, sexual assault, gon na, first time, last year"
ptsd,2020-1,1,"ptsd, help, trauma, therapy, know, diagnosed, anxiety, year, therapist, anyone","diagnosed ptsd, panic attack, anyone else, year ago, sexual abuse, ptsd symptom, mental health, traumatic event, recently diagnosed, wondering anyone"
ptsd,2020-1,2,"nightmare, sleep, night, dream, wake, anyone, prazosin, like, asleep, stop","night terror, anyone else, fall asleep, every night, ptsd nightmare, last night, go sleep, night nightmare, nightmare every, want sleep"
ptsd,2020-1,3,"feel, like, know, get, feeling, time, really, anyone, want, ptsd","feel like, anyone else, make feel, else feel, panic attack, feeling like, felt like, feel way, diagnosed ptsd, sometimes feel"
ptsd,2020-1,4,"like, know, time, year, would, get, thing, feel, one, really","feel like, year ago, first time, panic attack, year old, sexual abuse, felt like, even though, every time, last year"
ptsd,2018-1,0,"nightmare, dream, sleep, night, hour, terror, wake, get, ptsd, like","night terror, every night, want sleep, make stop, ptsd nightmare, year ago, nightmare hello, fall asleep, nightmare involving, getting worse"
ptsd,2018-1,1,"ptsd, experience, help, therapy, symptom, anxiety, year, recently, anyone, therapist","diagnosed ptsd, anyone else, year ago, anyone experience, help ptsd, depression anxiety, recently diagnosed, long time, traumatic event, ptsd symptom"
ptsd,2018-1,2,"ptsd, anyone, people, else, friend, http, trauma, know, like, mental","anyone else, mental health, mental illness, panic attack, go away, best friend, anyone know, help friend, http amp, ptsd like"
ptsd,2018-1,3,"back, work, know, job, like, going, time, go, feel, get","feel like, panic attack, last year, going back, go back, want go, first time, ca get, flash back, high school"
ptsd,2018-1,4,"feel, like, year, know, time, really, thing, get, even, would","feel like, year old, year ago, anyone else, make feel, sexual abuse, even though, 10 year, feel guilty, first time"
addiction,2019-1,0,"http, addiction, amp, survey, video, x200b, people, link, treatment, please","http http, http amp, addiction http, amp x200b, x200b http, addiction addiction, drug addiction, article http, link http, treatment center"
addiction,2019-1,1,"addiction, addicted, day, get, like, know, porn, time, help, drug","feel like, video game, need help, anyone else, trying get, cold turkey, porn addiction, every day, get addicted, day clean"
addiction,2019-1,2,"help, weed, smoking, want, know, friend, day, quit, stop, need","smoking weed, need help, feel like, want stop, smoke weed, every day, quit smoking, really want, please help, cold turkey"
addiction,2019-1,3,"like, feel, time, get, year, day, know, drug, life, want","feel like, year ago, first time, month ago, last year, every day, get better, even though, year old, month clean"
addiction,2019-1,4,"amp, x200b, addiction, know, feel, year, http, like, want, time","amp x200b, x200b amp, amp amp, http amp, feel like, x200b http, http http, addiction amp, x200b know, loved one"
schizophrenia,2019-2,0,"amp, x200b, friend, http, schizophrenia, help, like, told, know, someone","amp x200b, http http, http amp, amp amp, x200b http, mental illness, friend schizophrenia, looking someone, help please, help friend"
schizophrenia,2019-2,1,"voice, hear, head, like, thought, people, know, time, hearing, real","hear voice, voice head, hearing voice, voice like, feel like, voice say, anybody voice, voice telling, thought voice, two voice"
schizophrenia,2019-2,2,"anyone, like, get, time, feel, year, else, people, day, medication","anyone else, side effect, feel like, mental health, psychotic episode, schizoaffective disorder, last night, recently diagnosed, get better, one day"
schizophrenia,2019-2,3,"like, feel, know, thing, people, want, really, think, get, time","feel like, dont know, year ago, every time, first time, make sense, mental health, anyone else, every day, diagnosed schizophrenia"
schizophrenia,2019-2,4,"schizophrenia, symptom, hallucination, delusion, know, anyone, experience, like, diagnosed, question","anyone else, negative symptom, diagnosed schizophrenia, hallucination delusion, positive symptom, people schizophrenia, auditory hallucination, visual hallucination, hey guy, anyone know"
suicidewatch,2018-1,0,"want, ca, die, anymore, fucking, life, hate, know, live, like","want die, wan na, feel like, want live, gon na, want kill, want end, anymore want, die want, ca even"
suicidewatch,2018-1,1,"feel, like, know, life, want, get, year, friend, time, would","feel like, year old, get better, every day, high school, want die, year ago, suicidal thought, make feel, best friend"
suicidewatch,2018-1,2,"im, dont, cant, ive, want, feel, like, know, life, anymore","dont know, dont want, feel like, im going, im tired, like im, know im, want die, think im, im scared"
suicidewatch,2018-1,3,"life, know, suicide, going, want, feel, like, day, get, year","feel like, suicidal thought, gon na, year old, want die, get better, commit suicide, going kill, every day, year ago"
suicidewatch,2018-1,4,"please, someone, help, need, talk, know, want, anyone, feel, really","someone talk, please help, need someone, need help, talk someone, someone please, feel like, need talk, really need, someone help"
autism,2020-1,0,"autism, anyone, like, autistic, people, get, know, else, help, time","anyone else, autistic people, year old, feel like, would like, first time, weighted blanket, eye contact, people autism, anyone know"
autism,2020-1,1,"like, people, feel, autism, know, really, get, thing, friend, think","feel like, anyone else, autistic people, year old, make feel, even though, people autism, thing like, high functioning, eye contact"
autism,2020-1,2,"autism, school, help, parent, year, kid, child, autistic, diagnosed, would","year old, high functioning, high school, autistic child, diagnosed autism, child autism, non verbal, need help, get diagnosed, autistic kid"
autism,2020-1,3,"interest, special, like, one, people, anyone, thing, feel, want, get","special interest, anyone else, one like, one special, talking special, talk special, feel like, people special, stuff like, wondering anyone"
autism,2020-1,4,"http, amp, hat, survey, people, x200b, autism, autistic, link, child","http http, amp x200b, amp amp, http amp, autistic people, poll http, view poll, link http, autism spectrum, child autism"
