depression,2019-1,0,"amp, x200b, feel, like, life, depression, time, know, want, year","amp x200b, x200b amp, feel like, http amp, x200b feel, x200b know, x200b anyone, life amp, anyone else, make feel"
depression,2019-1,1,"depression, want, get, know, life, day, like, help, feel, anyone","anyone else, feel like, wan na, want die, gon na, mental health, first time, get better, depression anxiety, suicidal thought"
depression,2019-1,2,"life, friend, year, know, like, get, time, want, feel, really","feel like, high school, year ago, year old, get better, best friend, every day, last year, even though, first time"
depression,2019-1,3,"feel, like, want, know, people, feeling, life, even, really, time","feel like, make feel, anyone else, else feel, feeling like, feel way, want feel, feel better, know feel, feel alone"
depression,2019-1,4,"im, dont, cant, feel, like, ive, want, know, life, friend","dont know, dont want, feel like, like im, im going, im tired, wan na, know im, dont even, think im"
alcoholism,2018-2,0,"alcoholic, liver, social, sober, drinking, husband, http, drink, thing, cirrhosis","http http, fatty liver, social setting, functioning alcoholic, told alcoholic, drink social, tell husband, 47 day, blood pressure, recently found"
alcoholism,2018-2,1,"get, know, help, friend, mom, family, drink, want, like, drinking","feel like, family member, want get, need help, year ago, get help, year old, best friend, come home, trying quit"
alcoholism,2018-2,2,"day, need, alcohol, meeting, im, year, going, life, like, help","need help, last night, amp x200b, alcohol poisoning, http http, auditory hallucination, feel like, aa meeting, dont know, cold turkey"
alcoholism,2018-2,3,"drink, drinking, time, feel, day, like, alcohol, night, get, would","feel like, year old, last night, amp x200b, every day, get drunk, year ago, quit drinking, started drinking, want stop"
alcoholism,2018-2,4,"withdrawal, drinking, drink, symptom, know, time, day, really, binge, year","withdrawal symptom, anyone else, feel like, binge drinking, cold turkey, anyone know, stop drinking, alcohol withdrawal, first time, week ago"
