adhd,2019-2,4,"like, feel, get, thing, time, know, adhd, work, really, even","feel like, high school, even though, amp x200b, year old, feeling like, anyone else, hard time, make feel, felt like"
suicidewatch,2019-2,0,"life, suicide, know, going, kill, get, would, time, one, like","gon na, wan na, feel like, commit suicide, suicidal thought, last night, end life, amp x200b, anyone else, going kill"
suicidewatch,2019-2,1,"im, dont, cant, ive, feel, want, know, like, life, fucking","dont know, dont want, im going, feel like, im tired, know im, im scared, like im, gon na, im gon"
suicidewatch,2019-2,2,"feel, like, life, know, get, time, want, people, year, friend","feel like, get better, suicidal thought, every day, make feel, year old, best friend, year ago, want die, gon na"
suicidewatch,2019-2,3,"help, please, need, talk, someone, want, know, anyone, feel, really","please help, need help, need someone, someone talk, help please, someone please, talk someone, help want, help need, need talk"
suicidewatch,2019-2,4,"want, die, anymore, fucking, tired, life, ca, know, feel, kill","want die, want end, want kill, want live, feel like, really want, die want, anymore want, dont want, want go"
alcoholism,2019-2,0,"day, withdrawal, feel, drink, night, drinking, sleep, like, beer, get","feel like, withdrawal symptom, alcohol withdrawal, last night, anyone else, every day, every night, cold turkey, 10 day, panic attack"
alcoholism,2019-2,1,"im, dont, drink, day, drinking, good, time, know, problem, month","im sober, pretty sure, dont want, dont know, friend im, every day, want drink, cant stop, im scared, month sober"
alcoholism,2019-2,2,"sober, day, year, drinking, week, time, month, last, life, quit","day sober, quit drinking, year ago, sober october, first time, year old, feel like, year sober, get sober, every day"
alcoholism,2019-2,3,"drinking, drink, like, know, get, time, alcoholic, want, problem, stop","feel like, stop drinking, drinking problem, get drunk, year ago, year old, want stop, need help, amp x200b, want drink"
alcoholism,2019-2,4,"aa, know, alcohol, help, like, people, alcoholic, drink, get, anyone","stop drinking, amp x200b, aa meeting, feel like, anyone else, even know, need help, would like, gon na, 12 step"
schizophrenia,2020-1,0,"amp, http, x200b, mental, schizophrenia, health, like, help, people, link","amp x200b, http http, amp amp, mental health, http amp, link http, personality type, need help, support group, mental illness"
schizophrenia,2020-1,1,"voice, hear, head, hearing, like, thing, people, schizophrenia, heard, know","hear voice, hearing voice, voice head, started hearing, voice hear, anyone else, sound like, heard voice, voice know, month ago"
schizophrenia,2020-1,2,"hallucination, auditory, like, visual, see, experience, schizophrenia, else, get, know","auditory hallucination, visual hallucination, anyone else, think hallucination, hallucination like, diagnosed schizophrenia, experience hallucination, auditory visual, hallucination know, hallucination month"
schizophrenia,2020-1,3,"schizophrenia, anyone, med, symptom, help, think, year, people, like, experience","anyone else, side effect, negative symptom, weight gain, feel like, mental health, wan na, psychotic episode, taking med, last year"
schizophrenia,2020-1,4,"like, feel, know, want, people, thing, really, get, time, think","feel like, mental health, anyone else, felt like, mental illness, want know, year ago, make feel, even though, thing like"
socialanxiety,2019-2,0,"job, interview, get, anxiety, work, really, new, like, first, social","job interview, get job, new job, social anxiety, first job, feel like, need job, interview tomorrow, phone call, getting job"
socialanxiety,2019-2,1,"anxiety, social, people, life, help, like, get, feel, know, anyone","social anxiety, social situation, feel like, anxiety disorder, anxiety depression, social skill, anyone else, social interaction, people social, overcome social"
socialanxiety,2019-2,2,"people, get, go, like, know, anyone, time, class, going, day","anyone else, social anxiety, feel like, gon na, panic attack, wan na, amp x200b, eye contact, first time, every time"
socialanxiety,2019-2,3,"like, feel, people, know, get, even, talk, really, make, think","feel like, social anxiety, anyone else, make feel, talk people, eye contact, every time, else feel, even though, like people"
socialanxiety,2019-2,4,"friend, school, people, like, want, really, know, year, talk, one","make friend, feel like, social anxiety, high school, new friend, best friend, new people, close friend, one friend, making friend"
addiction,2020-1,0,"day, year, get, month, time, feel, take, like, week, taking","feel like, cold turkey, every day, next day, day ago, year ago, month clean, last night, gon na, anyone else"
addiction,2020-1,1,"http, recovery, addiction, help, meeting, book, people, group, amp, online","http http, alcohol addiction, let know, http amp, amp x200b, online meeting, loved one, support group, could help, substance abuse"
addiction,2020-1,2,"addiction, addicted, drug, know, like, stop, help, need, anyone, game","feel like, please help, video game, ca stop, need help, anyone else, addictive personality, porn addiction, amp x200b, social medium"
addiction,2020-1,3,"know, like, feel, want, get, time, drug, life, really, year","feel like, first time, make feel, every time, year ago, get better, best friend, dont know, need help, year old"
addiction,2020-1,4,"weed, smoking, quit, smoke, day, time, feel, stop, year, want","smoking weed, smoke weed, stop smoking, feel like, quit smoking, want quit, started smoking, every day, first time, smoking cigarette"
healthanxiety,2018-1,0,"flu, people, shot, scared, season, get, dying, ache, fever, cold","flu shot, get flu, dying flu, got flu, flu season, sore throat, superbowl party, flu symptom, flu going, body ache"
healthanxiety,2018-1,1,"know, anxiety, day, help, one, like, worried, right, could, anyone","anyone else, health anxiety, long term, please help, last night, ear infection, year ago, hey everyone, feel like, month ago"
healthanxiety,2018-1,2,"cancer, node, lymph, doctor, swollen, neck, year, one, like, time","lymph node, swollen lymph, health anxiety, ct scan, breast cancer, colon cancer, lung cancer, year ago, left side, week ago"
healthanxiety,2018-1,3,"anxiety, like, feel, heart, health, get, time, something, symptom, thing","health anxiety, feel like, panic attack, anyone else, heart attack, something wrong, heart rate, year ago, feeling like, year old"
healthanxiety,2018-1,4,"pain, chest, back, day, feel, week, test, blood, like, doctor","blood test, feel like, chest pain, came back, back pain, year old, health anxiety, right side, went doctor, week ago"
anxiety,2018-1,0,"anxiety, anyone, get, like, feel, anxious, help, else, know, time","anyone else, feel like, social anxiety, gon na, first time, anxiety attack, else get, anxiety disorder, panic attack, even though"
anxiety,2018-1,1,"like, feel, know, anxiety, get, friend, thing, time, want, people","feel like, anyone else, make feel, even though, social anxiety, panic attack, every time, felt like, high school, first time"
anxiety,2018-1,2,"job, work, interview, get, anxiety, new, feel, like, day, time","new job, job interview, feel like, get job, panic attack, got job, quit job, first job, job anxiety, started new"
anxiety,2018-1,3,"attack, panic, anxiety, like, feel, heart, day, get, feeling, time","panic attack, anxiety attack, feel like, heart attack, anxiety panic, anyone else, felt like, first panic, heart rate, last night"
anxiety,2018-1,4,"medication, anxiety, doctor, taking, take, effect, med, side, prescribed, zoloft","side effect, anyone else, feel like, panic attack, started taking, anxiety medication, anxiety depression, anyone experience, year ago, first time"
depression,2019-2,0,"depression, help, day, get, like, feel, know, anyone, time, need","anyone else, feel like, side effect, mental health, first time, need help, depression anxiety, suicidal thought, every day, wan na"
depression,2019-2,1,"im, dont, cant, ive, feel, like, want, know, friend, life","dont know, feel like, dont want, like im, im tired, im going, wan na, know im, im scared, think im"
depression,2019-2,2,"want, life, fucking, hate, ca, die, anymore, tired, get, feel","want die, wan na, feel like, want kill, gon na, wish could, want go, hate life, want live, every day"
depression,2019-2,3,"feel, like, know, feeling, want, get, life, time, people, even","feel like, make feel, anyone else, else feel, feeling like, know feel, like shit, feel better, time feel, life feel"
depression,2019-2,4,"friend, like, year, know, time, life, feel, really, get, even","feel like, amp x200b, high school, year ago, best friend, year old, get better, even though, last year, every day"
EDAnonymous,2019-2,0,"look, like, skinny, body, fat, people, see, hate, feel, want","look like, feel like, anyone else, body dysmorphia, lose weight, skinny jean, skinny girl, make feel, first time, gon na"
EDAnonymous,2019-2,1,"feel, like, know, eating, want, really, ed, get, even, eat","feel like, eating disorder, make feel, even though, gon na, anyone else, first time, wan na, amp x200b, get help"
EDAnonymous,2019-2,2,"weight, lose, like, feel, lost, pound, back, want, eating, day","lose weight, feel like, losing weight, weight loss, weight gain, much weight, gained weight, gain weight, lost weight, eating disorder"
EDAnonymous,2019-2,3,"like, calorie, ed, today, day, time, anyone, get, eating, one","anyone else, eating disorder, gon na, wan na, first time, feel like, diet coke, ice cream, last night, got ta"
EDAnonymous,2019-2,4,"food, eat, eating, binge, like, day, calorie, feel, even, know","anyone else, feel like, safe food, binge food, want eat, food eat, could eat, every day, gon na, eat anything"
alcoholism,2019-1,0,"amp, x200b, http, drinking, drink, like, year, feel, day, beer","amp x200b, http http, http amp, feel like, drinking amp, amp nbsp, x200b http, x200b thanks, day amp, weekend amp"
alcoholism,2019-1,1,"day, sober, today, time, week, last, drink, night, year, feel","last night, day sober, feel like, first time, year old, anyone else, every day, gon na, last year, need help"
alcoholism,2019-1,2,"withdrawal, day, symptom, drink, turkey, cold, drinking, quit, night, last","cold turkey, withdrawal symptom, feel like, want quit, go cold, every day, drink day, experience withdrawal, alcohol withdrawal, next day"
alcoholism,2019-1,3,"alcohol, help, alcoholic, know, drinking, want, life, get, like, year","anyone else, need help, month sober, feel like, alcohol abuse, stop drinking, replace alcohol, heavy drinker, aa meeting, thanks advance"
alcoholism,2019-1,4,"drink, drinking, know, like, feel, time, get, day, want, alcohol","feel like, stop drinking, started drinking, every day, year old, every night, year ago, need help, want drink, last year"
healthanxiety,2020-1,0,"like, worried, get, day, anyone, feel, scared, know, time, help","anyone else, feel like, please help, day ago, gon na, month ago, health anxiety, panic attack, ct scan, look like"
healthanxiety,2020-1,1,"heart, attack, chest, anxiety, palpitation, rate, feel, like, time, panic","heart rate, heart attack, panic attack, heart palpitation, feel like, chest pain, heart beat, health anxiety, heart anxiety, heart problem"
healthanxiety,2020-1,2,"pain, like, back, feel, day, left, right, doctor, chest, started","feel like, chest pain, left side, blood test, right side, week ago, came back, go away, back pain, health anxiety"
healthanxiety,2020-1,3,"anxiety, health, feel, like, symptom, get, know, time, really, going","health anxiety, feel like, panic attack, anyone else, year ago, even though, make feel, last year, year old, feeling like"
healthanxiety,2020-1,4,"node, lymph, swollen, lymphoma, neck, lump, cancer, feel, like, groin","lymph node, swollen lymph, node neck, node swollen, side neck, behind ear, groin area, go away, feel like, normal lymph"
adhd,2020-1,0,"adderall, xr, day, taking, take, feel, like, mg, ir, prescribed","adderall xr, taking adderall, side effect, prescribed adderall, take adderall, adderall ir, feel like, anyone else, mg adderall, 20 mg"
adhd,2020-1,1,"adhd, diagnosed, medication, diagnosis, get, doctor, help, year, know, like","diagnosed adhd, adhd medication, year old, got diagnosed, feel like, adult adhd, people adhd, mental health, adhd diagnosis, get diagnosed"
adhd,2020-1,2,"like, feel, thing, get, time, really, know, adhd, even, work","feel like, even though, high school, anyone else, thing like, make feel, felt like, first time, diagnosed adhd, year old"
adhd,2020-1,3,"vyvanse, med, day, taking, take, effect, ritalin, medication, feel, concerta","side effect, feel like, take med, anyone else, adhd med, started taking, first day, taking med, first time, taking vyvanse"
adhd,2020-1,4,"get, time, like, adhd, thing, work, anyone, day, one, know","anyone else, feel like, amp x200b, http http, first time, gon na, wan na, hard time, every time, something else"
EDAnonymous,2020-1,0,"day, like, calorie, today, anyone, get, eating, ed, time, really","anyone else, eating disorder, gon na, wan na, new year, feel like, ice cream, many calorie, diet coke, last night"
EDAnonymous,2020-1,1,"weight, lose, like, feel, day, want, gain, know, eating, year","lose weight, gain weight, weight loss, feel like, weight gain, losing weight, gaining weight, eating disorder, gained weight, healthy weight"
EDAnonymous,2020-1,2,"like, feel, know, ed, want, look, people, really, get, body","feel like, anyone else, eating disorder, look like, make feel, else feel, even though, felt like, wan na, feel better"
EDAnonymous,2020-1,3,"im, dont, like, ive, eat, cant, feel, know, want, day","dont know, like im, feel like, im going, gon na, im scared, im still, im gon, know im, wan na"
EDAnonymous,2020-1,4,"eat, food, eating, like, day, feel, want, time, calorie, binge","feel like, eating disorder, safe food, want eat, gon na, anyone else, eat anything, eat something, binge eating, every day"
bipolarreddit,2018-1,0,"anyone, else, like, get, time, know, guy, bipolar, thought, thing","anyone else, feel like, mental health, bipolar disorder, mental illness, hi everyone, else experience, someone else, new year, one another"
bipolarreddit,2018-1,1,"lamictal, taking, started, effect, side, like, really, experience, getting, dose","side effect, birth control, depressive episode, started taking, taking lamictal, short term, anyone else, getting depressed, good vibe, help please"
bipolarreddit,2018-1,2,"bipolar, diagnosed, manic, depression, year, episode, help, know, get, like","bipolar disorder, diagnosed bipolar, manic episode, feel like, year ago, recently diagnosed, mood swing, mental health, first time, side effect"
bipolarreddit,2018-1,3,"feel, like, want, time, really, thing, get, know, going, everything","feel like, make feel, mixed episode, want go, long time, even though, thing want, anyone else, last night, felt like"
bipolarreddit,2018-1,4,"lithium, seroquel, day, med, latuda, medication, taking, anyone, weight, experience","side effect, weight gain, anyone else, feel like, taking med, wondering anyone, go away, anyone experience, day ago, taking lithium"
autism,2019-2,0,"like, feel, get, time, thing, really, know, job, want, work","feel like, anyone else, amp x200b, high functioning, year old, thing like, every time, long time, make feel, would like"
autism,2019-2,1,"people, autism, like, autistic, friend, know, social, think, really, feel","autistic people, feel like, people autism, social anxiety, eye contact, anyone else, make friend, social cue, high functioning, diagnosed autism"
autism,2019-2,2,"anyone, interest, like, autistic, autism, else, one, know, people, special","special interest, anyone else, anyone know, autistic people, gon na, weighted blanket, anybody else, year old, wan na, feel like"
autism,2019-2,3,"autism, help, child, year, school, son, would, parent, old, diagnosed","year old, high functioning, child autism, diagnosed autism, autistic child, autism spectrum, old son, recently diagnosed, functioning autism, wondering anyone"
autism,2019-2,4,"http, amp, autism, survey, x200b, please, research, study, help, autistic","http http, amp x200b, http amp, discord server, please vote, let know, people autism, http please, autism spectrum, child autism"
lonely,2018-1,0,"lonely, people, day, alone, feel, like, friend, time, really, loneliness","feel like, valentine day, feel lonely, wan na, anyone else, would like, gon na, someone else, anyone interested, lonely people"
lonely,2018-1,1,"im, dont, like, friend, feel, people, know, want, ive, even","dont know, feel like, like im, dont want, im alone, dont even, im lonely, dont really, im going, make friend"
lonely,2018-1,2,"feel, like, friend, people, know, time, life, never, one, want","feel like, feel alone, make feel, best friend, feel way, wish could, gon na, even though, really want, anyone else"
lonely,2018-1,3,"friend, year, school, new, like, time, one, really, feel, people","high school, feel like, best friend, new friend, year ago, year old, make friend, feel lonely, last year, new year"
lonely,2018-1,4,"talk, someone, want, anyone, lonely, friend, need, chat, feel, like","someone talk, want talk, anyone want, need someone, wan na, want someone, need friend, talk someone, feeling lonely, feel free"
bipolarreddit,2020-1,0,"episode, manic, mania, depressive, like, mixed, day, time, feel, bipolar","manic episode, depressive episode, mixed episode, anyone else, feel like, amp x200b, hypomanic episode, diagnosed bipolar, last year, psychotic feature"
bipolarreddit,2020-1,1,"lithium, seroquel, taking, lamictal, effect, sleep, abilify, side, anyone, experience","side effect, anyone else, weight gain, taking seroquel, anyone experience, feel like, 100 mg, taking lithium, mg seroquel, sex drive"
bipolarreddit,2020-1,2,"med, day, get, anyone, know, latuda, going, work, go, month","anyone else, gon na, feel like, weight gain, wan na, anyone experience, next week, side effect, last week, taking med"
bipolarreddit,2020-1,3,"bipolar, diagnosed, disorder, year, medication, diagnosis, http, people, know, mental","bipolar disorder, diagnosed bipolar, mental health, http http, bipolar ii, year ago, recently diagnosed, feel like, anyone else, mood stabilizer"
bipolarreddit,2020-1,4,"feel, like, know, want, time, get, really, thing, life, feeling","feel like, anyone else, mental health, bipolar disorder, even though, make feel, felt like, last year, first time, depressive episode"
bpd,2020-1,0,"bpd, diagnosed, diagnosis, know, people, help, disorder, symptom, like, anyone","diagnosed bpd, people bpd, personality disorder, anyone else, feel like, mental health, someone bpd, borderline personality, bpd symptom, recently diagnosed"
bpd,2020-1,1,"like, time, know, want, feel, really, relationship, year, friend, get","feel like, even though, year ago, best friend, first time, mental health, felt like, month ago, make feel, last year"
bpd,2020-1,2,"fp, want, feel, like, friend, know, person, relationship, get, really","feel like, favorite person, best friend, new fp, anyone else, fp feel, fp fp, relationship fp, fp know, lost fp"
bpd,2020-1,3,"feel, like, know, people, want, feeling, even, get, thing, make","feel like, anyone else, make feel, dae feel, else feel, feeling like, even know, even though, dont know, feel way"
bpd,2020-1,4,"like, feel, anyone, get, know, people, want, really, else, time","anyone else, feel like, mental health, wan na, self harm, gon na, last night, mood swing, amp x200b, make feel"
lonely,2018-2,0,"christmas, merry, alone, year, holiday, everyone, day, time, family, happy","merry christmas, christmas eve, lonely christmas, time year, new year, christmas alone, feeling lonely, holiday alone, hope everyone, christmas lonely"
lonely,2018-2,1,"feel, like, know, want, really, get, people, friend, life, one","feel like, amp x200b, make feel, feel lonely, feel alone, dont know, feeling like, anyone else, even though, even know"
lonely,2018-2,2,"friend, people, year, like, new, make, feel, really, time, one","best friend, make friend, feel like, new year, new friend, high school, close friend, year old, new people, friend group"
lonely,2018-2,3,"lonely, feel, like, alone, year, feeling, life, get, friend, time","feel like, feel lonely, anyone else, new year, year old, would like, feeling lonely, want go, never felt, felt like"
lonely,2018-2,4,"talk, someone, want, anyone, need, chat, friend, wan, looking, na","someone talk, wan na, want someone, want talk, need someone, anyone want, feel free, would like, looking friend, na talk"
alcoholism,2020-1,0,"help, need, aa, alcoholic, http, know, meeting, go, please, want","need help, http http, aa meeting, need someone, please help, amp amp, http amp, 12 step, want help, sinclair method"
alcoholism,2020-1,1,"day, withdrawal, drinking, night, week, sleep, anxiety, drink, year, symptom","cold turkey, withdrawal symptom, every day, every night, quit drinking, panic attack, last night, feel like, year old, last day"
alcoholism,2020-1,2,"year, drinking, time, know, get, really, one, like, help, drunk","year ago, feel like, year old, first time, last year, last night, every day, stop drinking, get help, every time"
alcoholism,2020-1,3,"feel, sober, day, like, alcohol, drinking, know, want, get, today","feel like, anyone else, day sober, month sober, stay sober, gon na, wan na, want stop, stop drinking, anyone know"
alcoholism,2020-1,4,"drink, drinking, like, day, alcohol, feel, stop, drunk, night, beer","feel like, every night, get drunk, drink every, stop drinking, every day, want drink, year old, drink much, next day"
bpd,2018-1,0,"feel, like, get, know, feeling, thing, people, want, else, anyone","feel like, anyone else, else feel, make feel, feeling like, feel way, someone else, sometimes feel, ever feel, feel empty"
bpd,2018-1,1,"fp, know, want, feel, like, friend, would, much, person, someone","feel like, anyone else, old fp, best friend, new fp, gon na, hard time, new sub, every day, feel good"
bpd,2018-1,2,"friend, want, know, like, time, feel, get, really, love, thing","feel like, best friend, even though, year ago, gon na, felt like, first time, month ago, someone else, every day"
bpd,2018-1,3,"bpd, diagnosed, diagnosis, year, help, know, like, therapist, really, symptom","diagnosed bpd, feel like, personality disorder, mental health, year ago, got diagnosed, year old, bpd symptom, anyone else, recently diagnosed"
bpd,2018-1,4,"anyone, people, bpd, like, get, know, else, time, feel, help","anyone else, feel like, mental health, wondering anyone, people bpd, please help, self harm, personality disorder, borderline personality, even though"
suicidewatch,2018-2,0,"amp, x200b, life, know, time, like, year, want, people, feel","amp x200b, x200b amp, http amp, amp amp, feel like, http http, please let, x200b know, get better, want kill"
suicidewatch,2018-2,1,"im, dont, cant, want, ive, feel, like, know, life, die","dont know, dont want, feel like, want die, im going, think im, im sorry, cant take, im tired, know im"
suicidewatch,2018-2,2,"na, fucking, die, want, wan, tired, gon, life, anymore, hate","wan na, gon na, want die, na die, want fucking, na go, tired tired, die want, fucking die, fucking tired"
suicidewatch,2018-2,3,"feel, like, want, know, life, get, friend, year, people, time","feel like, get better, want die, every day, year old, make feel, year ago, suicidal thought, want end, want kill"
suicidewatch,2018-2,4,"help, want, suicide, kill, life, know, think, going, need, one","want die, feel like, anyone else, need help, commit suicide, please help, suicidal thought, going kill, someone talk, suicide attempt"
anxiety,2018-2,0,"job, work, anxiety, get, feel, like, interview, new, know, time","new job, feel like, amp x200b, job interview, good job, anxiety work, get job, go work, got job, anyone else"
anxiety,2018-2,1,"like, feel, know, friend, anxiety, people, want, really, get, thing","feel like, amp x200b, social anxiety, make feel, even though, felt like, anyone else, high school, feeling like, best friend"
anxiety,2018-2,2,"attack, panic, anxiety, feel, like, heart, get, time, help, day","panic attack, anxiety attack, feel like, heart attack, felt like, anyone else, chest pain, anxiety panic, gon na, attack feel"
anxiety,2018-2,3,"anxiety, anyone, feel, like, else, get, day, time, experience, year","anyone else, feel like, side effect, amp x200b, anxiety depression, anyone experience, health anxiety, else experience, anxiety attack, month ago"
anxiety,2018-2,4,"anxiety, get, help, know, like, anxious, someone, really, need, sleep","feel like, anyone else, gon na, need help, http http, get anxious, amp x200b, anxiety attack, weighted blanket, first time"
bpd,2019-1,0,"feel, like, people, know, feeling, get, anyone, want, make, thing","feel like, anyone else, make feel, dae feel, else feel, feeling like, sometimes feel, feel way, wan na, felt like"
bpd,2019-1,1,"bpd, diagnosed, diagnosis, people, anyone, disorder, like, symptom, help, know","diagnosed bpd, personality disorder, people bpd, anyone else, mental health, feel like, someone bpd, recently diagnosed, bpd symptom, wondering anyone"
bpd,2019-1,2,"get, like, know, want, anyone, day, really, time, feel, fp","anyone else, feel like, wan na, gon na, mental health, first time, self harm, even though, last night, wish could"
bpd,2019-1,3,"want, know, like, friend, feel, time, really, year, love, thing","feel like, best friend, even though, year ago, get better, month ago, felt like, mental health, first time, make feel"
bpd,2019-1,4,"amp, x200b, like, bpd, know, feel, time, get, really, people","amp x200b, x200b amp, feel like, http amp, even though, personality disorder, anyone else, bpd amp, people bpd, mental health"
