depression,2018-2,0,"fucking, hate, want, fuck, die, life, shit, people, know, like","want die, wan na, feel like, piece shit, hate life, gon na, wish could, hate hate, fucking hate, fuck fuck"
depression,2018-2,1,"depression, anyone, feel, like, help, know, life, day, else, get","anyone else, feel like, amp x200b, http http, mental health, wish could, side effect, depression anxiety, need help, feel better"
depression,2018-2,2,"feel, like, know, want, people, life, even, get, really, feeling","feel like, make feel, anyone else, still feel, feel better, get better, feeling like, feel way, wan na, feel empty"
depression,2018-2,3,"im, dont, ive, feel, want, like, cant, know, friend, even","dont know, dont want, feel like, like im, dont even, im going, im scared, im still, dont think, know im"
depression,2018-2,4,"year, get, friend, time, know, life, like, really, day, school","amp x200b, feel like, year old, year ago, high school, first time, best friend, every day, last year, month ago"
schizophrenia,2018-1,0,"delusion, hallucination, better, thing, know, let, see, people, get, ever","visual hallucination, little bit, auditory hallucination, get better, hear voice, paranoid delusion, tactile hallucination, wondering anyone, ever tried, know delusion"
schizophrenia,2018-1,1,"year, time, help, thing, get, like, really, know, would, day","year ago, month ago, year old, feel like, mental health, last night, hearing voice, even though, last year, anyone else"
schizophrenia,2018-1,2,"schizophrenia, would, symptom, mental, help, disorder, question, book, diagnosed, like","mental health, someone schizophrenia, people schizophrenia, would like, mental illness, negative symptom, diagnosed schizophrenia, mental disorder, schizophrenia also, schizophrenia anyone"
schizophrenia,2018-1,3,"like, feel, know, want, people, thing, voice, get, thought, think","feel like, anyone else, gon na, seems like, make feel, hear voice, like people, make sense, year ago, want talk"
schizophrenia,2018-1,4,"anyone, med, like, else, feel, episode, work, psychotic, people, get","anyone else, psychotic episode, side effect, feel like, anyone experience, wondering anyone, taking med, anybody else, felt like, hard time"
anxiety,2019-1,0,"medication, anxiety, doctor, med, take, taking, effect, side, prescribed, day","side effect, feel like, panic attack, anyone else, anxiety medication, started taking, anxiety med, first time, amp x200b, anxiety depression"
anxiety,2019-1,1,"attack, panic, anxiety, heart, like, feel, get, day, time, feeling","panic attack, anxiety attack, feel like, heart attack, anyone else, anxiety panic, heart rate, chest pain, felt like, amp x200b"
anxiety,2019-1,2,"anxiety, get, anyone, like, anxious, feel, help, know, else, time","anyone else, feel like, amp x200b, social anxiety, gon na, else get, first time, anxiety attack, mental health, get anxious"
anxiety,2019-1,3,"like, feel, anxiety, know, get, want, friend, really, time, people","feel like, amp x200b, even though, make feel, anyone else, panic attack, social anxiety, felt like, year ago, feeling like"
anxiety,2019-1,4,"job, work, interview, anxiety, new, get, like, feel, day, time","new job, feel like, job interview, get job, amp x200b, full time, panic attack, got job, quit job, first job"
adhd,2019-1,0,"adhd, diagnosed, medication, doctor, year, get, help, diagnosis, know, like","diagnosed adhd, year old, feel like, people adhd, year ago, adhd medication, adhd med, got diagnosed, adhd symptom, adult adhd"
adhd,2019-1,1,"like, feel, thing, get, time, know, really, adhd, work, even","feel like, anyone else, high school, even though, thing like, make feel, diagnosed adhd, first time, felt like, something else"
adhd,2019-1,2,"get, time, adhd, like, day, anyone, work, thing, know, one","anyone else, feel like, http http, amp x200b, first time, every time, tl dr, gon na, people adhd, last night"
adhd,2019-1,3,"amp, x200b, adhd, like, get, time, feel, thing, medication, year","amp x200b, x200b amp, feel like, http amp, http http, x200b anyone, x200b thanks, adhd amp, diagnosed adhd, amp amp"
adhd,2019-1,4,"adderall, vyvanse, day, taking, take, med, effect, feel, medication, dose","side effect, feel like, adderall xr, anyone else, started taking, taking adderall, first time, take med, diagnosed adhd, taking vyvanse"
lonely,2019-2,0,"talk, someone, want, need, anyone, chat, lonely, friend, looking, really","someone talk, need someone, want talk, anyone want, want someone, talk someone, want chat, looking someone, talk anything, talk anyone"
lonely,2019-2,1,"feel, like, know, people, want, life, alone, time, even, one","feel like, feel lonely, make feel, feel alone, even though, want someone, feeling like, like one, still feel, anyone else"
lonely,2019-2,2,"friend, people, school, like, one, really, year, make, feel, time","make friend, best friend, high school, feel like, new friend, friend group, close friend, good friend, one friend, group friend"
lonely,2019-2,3,"wan, na, talk, anyone, friend, feel, lonely, like, chat, people","wan na, na talk, anyone wan, na chat, gon na, na hang, anybody wan, feel like, friend wan, na feel"
lonely,2019-2,4,"lonely, friend, alone, people, like, one, want, feel, anyone, know","anyone else, feel lonely, feel like, year old, http http, amp x200b, gon na, wish could, feeling lonely, would like"
EDAnonymous,2018-2,0,"sub, banned, reddit, peach, people, community, proed, discord, support, meme","proed got, got banned, old sub, discord server, sub get, free add, ed support, processing img, got peach, idea work"
EDAnonymous,2018-2,1,"weight, im, look, hate, fat, body, feel, want, like, see","lose weight, look like, goal weight, losing weight, feel like, wan na, gain weight, weight gain, anyone else, lost weight"
EDAnonymous,2018-2,2,"eat, calorie, day, food, eating, like, binge, want, know, ate","anyone else, feel like, calorie day, many calorie, last night, every day, much food, eat like, gon na, even though"
EDAnonymous,2018-2,3,"feel, like, ed, eating, know, really, want, get, make, people","feel like, eating disorder, anyone else, make feel, amp x200b, lose weight, last night, look like, wan na, gon na"
EDAnonymous,2018-2,4,"anyone, know, get, really, fucking, fuck, week, like, going, food","anyone else, first time, halo top, time year, eating disorder, anything else, thing miss, low cal, chest pain, gon na"
bipolarreddit,2018-2,0,"manic, want, episode, hour, mental, see, health, sleep, talk, http","mental health, dont know, manic episode, talk someone, anyone else, amp x200b, see therapist, much hell, hour sleep, experience hotlines"
bipolarreddit,2018-2,1,"get, day, med, time, going, week, year, work, need, psychiatrist","amp x200b, side effect, rapid cycling, feel like, panic attack, mood stabilizer, sleep lot, week ago, first time, one day"
bipolarreddit,2018-2,2,"like, feel, know, people, friend, thing, something, really, much, make","feel like, amp x200b, make feel, even though, best friend, feel better, per day, much coward, anyone else, feel much"
bipolarreddit,2018-2,3,"lithium, weight, medication, taking, anyone, gain, abilify, bipolar, else, started","anyone else, weight gain, amp x200b, dry mouth, bipolar disorder, gain weight, diagnosed bipolar, coping mechanism, research chemical, taking lithium"
bipolarreddit,2018-2,4,"bipolar, thing, like, depression, episode, get, life, anyone, med, feel","anyone else, diagnosed bipolar, feel like, else experience, best antidepressant, depression blood, depressive episode, manic episode, mixed episode, bipolar disorder"
addiction,2019-2,0,"know, want, drug, get, friend, help, time, year, like, would","feel like, best friend, year ago, need help, year old, month ago, even though, get help, get better, amp x200b"
addiction,2019-2,1,"day, feel, like, time, year, get, life, month, know, sober","feel like, first time, cold turkey, year ago, every day, year old, day clean, anyone else, felt like, day sober"
addiction,2019-2,2,"im, dont, cant, ive, feel, know, like, get, want, stop","dont know, feel like, dont want, know im, im addicted, im trying, cant stop, gon na, cant get, need help"
addiction,2019-2,3,"addiction, help, addicted, http, recovery, anyone, addict, need, one, please","http http, need help, ca stop, feel like, please help, amp x200b, substance abuse, let know, would like, wan na"
addiction,2019-2,4,"weed, smoking, smoke, quit, day, year, time, like, get, cigarette","smoking weed, smoke weed, started smoking, quit smoking, stop smoking, every day, feel like, quit weed, weed every, want smoke"
socialanxiety,2020-1,0,"job, interview, work, anxiety, get, like, social, people, know, got","job interview, get job, social anxiety, new job, feel like, got job, find job, looking job, part time, retail job"
socialanxiety,2020-1,1,"friend, like, feel, people, know, really, talk, want, make, time","feel like, social anxiety, make friend, high school, talk people, make feel, anyone else, new people, around people, even though"
socialanxiety,2020-1,2,"anxiety, social, people, like, feel, get, anyone, help, know, think","social anxiety, anyone else, feel like, social situation, people social, socially anxious, social medium, social skill, social interaction, anxiety disorder"
socialanxiety,2020-1,3,"like, people, get, know, feel, anyone, time, go, really, want","anyone else, feel like, gon na, social anxiety, first time, eye contact, panic attack, http http, even though, wan na"
socialanxiety,2020-1,4,"im, dont, like, ive, know, feel, people, cant, want, think","dont know, feel like, im scared, like im, know im, social anxiety, think im, dont want, wan na, im always"
alcoholism,2018-1,0,"sober, today, meeting, alcoholic, aa, day, stay, family, first, year","sober today, year sober, stay sober, aa meeting, al anon, day sober, alcoholic anonymous, father alcoholic, recovering alcoholic, place anything"
alcoholism,2018-1,1,"drink, drinking, day, feel, like, get, go, year, time, week","feel like, cold turkey, every day, without drinking, year old, every night, stop drinking, drink every, day without, without alcohol"
alcoholism,2018-1,2,"help, know, dad, time, mom, alcoholic, get, year, want, like","feel like, year ago, last night, first time, stop drinking, year old, get help, need help, got drunk, please help"
alcoholism,2018-1,3,"im, need, help, like, alcohol, drink, night, feel, worried, get","last night, need help, avoid drinking, anyone tried, wan na, help im, device used, im worried, could get, feel like"
alcoholism,2018-1,4,"alcohol, drinking, drink, sober, year, day, know, anyone, month, feel","anyone else, much drink, feel like, month sober, last night, new year, hangover getting, drinking even, drink week, hey guy"
bpd,2018-2,0,"anyone, get, like, want, else, feel, day, fp, feeling, time","anyone else, feel like, wondering anyone, social medium, look like, anyone experience, someone else, wan na, gon na, ca stop"
bpd,2018-2,1,"feel, like, know, people, want, get, really, make, feeling, thing","feel like, make feel, anyone else, feel way, else feel, even know, dont know, feel bad, time feel, feeling like"
bpd,2018-2,2,"bpd, people, diagnosed, year, like, know, really, help, diagnosis, experience","mental health, diagnosed bpd, people bpd, personality disorder, feel like, anyone else, mental illness, year ago, fear abandonment, recently diagnosed"
bpd,2018-2,3,"amp, x200b, feel, like, bpd, know, want, love, time, really","amp x200b, x200b amp, feel like, x200b anyone, anyone else, http amp, know amp, etc etc, diagnosed bpd, x200b also"
bpd,2018-2,4,"want, know, time, like, get, friend, thing, really, feel, relationship","feel like, best friend, even though, first time, last night, month ago, mental health, year ago, every day, gon na"
socialanxiety,2019-1,0,"class, presentation, teacher, school, group, really, like, people, get, know","front class, social anxiety, high school, feel like, whole class, one class, gon na, public speaking, anyone else, presentation tomorrow"
socialanxiety,2019-1,1,"anxiety, social, people, help, amp, like, feel, x200b, anyone, get","social anxiety, amp x200b, feel like, anyone else, social situation, social interaction, anxiety disorder, social medium, panic attack, people social"
socialanxiety,2019-1,2,"job, interview, get, work, anxiety, like, social, people, working, know","job interview, get job, social anxiety, first job, new job, feel like, need job, good job, got job, interview tomorrow"
socialanxiety,2019-1,3,"like, people, feel, get, know, time, go, want, anyone, someone","feel like, anyone else, social anxiety, first time, gon na, eye contact, even though, wan na, every time, look like"
socialanxiety,2019-1,4,"friend, like, people, feel, know, really, talk, get, time, want","feel like, social anxiety, high school, make friend, anyone else, new people, talk people, new friend, even though, best friend"
depression,2018-1,0,"depression, get, help, day, like, know, feel, anyone, time, year","anyone else, feel like, side effect, depression anxiety, mental health, first time, need help, suicidal thought, gon na, wan na"
depression,2018-1,1,"feel, like, know, feeling, people, want, life, really, even, time","feel like, make feel, anyone else, else feel, feeling like, feel way, feel better, feel alone, felt like, like shit"
depression,2018-1,2,"want, fucking, hate, life, die, ca, know, people, anymore, feel","want die, feel like, wan na, want kill, want live, fucking hate, gon na, really want, want go, every day"
depression,2018-1,3,"im, dont, cant, feel, like, ive, know, want, friend, life","dont know, feel like, dont want, like im, know im, think im, wan na, im going, dont even, im tired"
depression,2018-1,4,"friend, year, like, know, time, get, life, feel, really, even","feel like, high school, year ago, last year, year old, best friend, even though, every day, first time, felt like"
socialanxiety,2018-2,0,"anxiety, social, feel, help, people, anyone, like, life, really, get","social anxiety, amp x200b, anyone else, feel like, social situation, social interaction, help social, http http, severe social, anxiety disorder"
socialanxiety,2018-2,1,"like, people, feel, know, get, think, really, want, time, even","feel like, amp x200b, social anxiety, anyone else, even though, eye contact, every time, people think, say something, felt like"
socialanxiety,2018-2,2,"people, like, anyone, get, time, going, go, feel, know, someone","anyone else, social anxiety, feel like, wan na, gon na, amp x200b, eye contact, small talk, feeling anxious, even though"
socialanxiety,2018-2,3,"friend, like, people, feel, school, know, really, want, talk, year","feel like, high school, make friend, social anxiety, best friend, amp x200b, group friend, friend group, new friend, one friend"
socialanxiety,2018-2,4,"job, interview, work, anxiety, get, like, day, people, social, feel","job interview, get job, new job, social anxiety, first job, feel like, first day, looking job, customer service, quit job"
bipolarreddit,2019-2,0,"episode, manic, mania, depressive, bipolar, anyone, like, thought, depressed, get","manic episode, depressive episode, anyone else, mixed episode, hypomanic episode, bipolar disorder, episode like, first manic, manic hypomanic, manic phase"
bipolarreddit,2019-2,1,"feel, like, feeling, know, get, want, really, people, time, make","feel like, anyone else, make feel, feeling like, wan na, ever feel, time feel, else feel, still feel, make sense"
bipolarreddit,2019-2,2,"year, want, know, time, get, bipolar, like, really, thing, week","feel like, mental health, bipolar disorder, diagnosed bipolar, first time, year ago, manic episode, last year, even though, felt like"
bipolarreddit,2019-2,3,"bipolar, anyone, experience, lamictal, help, med, medication, taking, know, seroquel","anyone else, side effect, bipolar disorder, anyone experience, mood stabilizer, last night, diagnosed bipolar, people experience, mental illness, personal experience"
bipolarreddit,2019-2,4,"lithium, take, effect, side, dose, feel, also, taking, like, anyone","side effect, 1200mg lithium, taking lithium, dose lithium, amp x200b, lithium side, lithium carbonate, put lithium, effect lithium, anyone know"
addiction,2018-2,0,"going, gambling, know, want, money, like, get, stop, addiction, life","gambling addiction, addicted drug, said look, program shit, feel like, know going, good treatment, addiction get, social medium, personal experience"
addiction,2018-2,1,"amp, x200b, http, help, day, know, addiction, get, mother, would","amp x200b, x200b amp, http http, amp amp, http amp, http m8b04da, x200b thanks, christmas gift, gift dopeman, writing play"
addiction,2018-2,2,"time, year, get, help, know, rehab, friend, using, got, want","feel like, get help, every time, go back, last year, year old, go rehab, first time, last time, drug use"
addiction,2018-2,3,"addiction, year, feel, day, like, drug, help, life, know, sober","feel like, video game, year ago, http http, need help, 10 year, every day, past year, day clean, anyone else"
addiction,2018-2,4,"weed, get, like, feel, smoking, quit, addicted, smoke, want, know","feel like, smoking weed, smoke weed, every day, want quit, need help, started smoking, gon na, get addicted, please help"
adhd,2018-2,0,"adhd, like, anyone, people, else, help, diagnosed, medication, feel, med","anyone else, feel like, diagnosed adhd, people adhd, adhd symptom, http http, look like, adhd med, side effect, adhd like"
adhd,2018-2,1,"like, feel, adhd, get, thing, time, know, really, life, year","feel like, high school, diagnosed adhd, year ago, year old, anyone else, felt like, amp x200b, make feel, long time"
adhd,2018-2,2,"time, get, work, day, thing, like, got, need, hour, something","feel like, last week, even though, every time, go back, last night, anyone else, video game, every day, gon na"
adhd,2018-2,3,"adderall, vyvanse, take, day, taking, medication, feel, med, dose, effect","side effect, adderall xr, feel like, taking adderall, started taking, first day, anyone else, taking vyvanse, take vyvanse, twice day"
adhd,2018-2,4,"amp, x200b, like, get, adhd, time, work, medication, day, thing","amp x200b, x200b amp, feel like, http amp, http http, x200b anyone, time amp, anyone else, side effect, want try"
bpd,2019-2,0,"fp, know, feel, person, like, friend, relationship, want, bpd, someone","feel like, favorite person, anyone else, fp fp, best friend, let go, new fp, even though, fp year, fp go"
bpd,2019-2,1,"bpd, diagnosed, people, diagnosis, know, symptom, like, help, therapist, think","diagnosed bpd, people bpd, personality disorder, feel like, mental health, anyone else, someone bpd, borderline personality, bpd symptom, bpd diagnosis"
bpd,2019-2,2,"feel, like, feeling, know, people, want, even, make, really, time","feel like, anyone else, make feel, dae feel, feeling like, wan na, feel way, time feel, else feel, even though"
bpd,2019-2,3,"get, anyone, want, like, know, day, time, feel, really, help","anyone else, feel like, amp x200b, self harm, social medium, first time, gon na, wish could, hard time, wan na"
bpd,2019-2,4,"know, like, want, friend, time, feel, really, would, thing, get","feel like, best friend, even though, felt like, year ago, every day, first time, mental health, amp x200b, make feel"
ptsd,2018-2,0,"feel, like, people, even, know, year, time, get, want, would","feel like, even though, year ago, panic attack, feeling like, first time, every day, anyone else, make feel, feel guilty"
ptsd,2018-2,1,"ptsd, flashback, diagnosed, symptom, http, year, treatment, time, experience, help","diagnosed ptsd, http http, feel like, symptom ptsd, mental health, year ago, ptsd diagnosis, get worse, year old, amp x200b"
ptsd,2018-2,2,"know, help, thing, back, ptsd, get, like, really, one, time","panic attack, feel like, anyone else, year old, amp x200b, last night, first time, month ago, year ago, trigger warning"
ptsd,2018-2,3,"sleep, nightmare, night, wake, dream, sleeping, ptsd, usually, year, last","go sleep, last night, every night, wake feeling, wake screaming, sleep hallucination, hurt bad, back sleep, sleep paralysis, remember dream"
ptsd,2018-2,4,"therapy, im, anyone, want, like, feel, ptsd, trauma, year, help","anyone else, feel like, dont know, amp x200b, someone talk, exposure therapy, therapy session, please help, sexual assault, sexual abuse"
autism,2018-1,0,"brother, autism, help, year, father, know, really, old, parent, work","brother autism, year old, severe autism, little brother, old brother, autism wondering, older brother, jury duty, younger brother, even though"
autism,2018-1,1,"get, like, anyone, autistic, people, go, sensory, feel, sleep, would","anyone else, feel like, sensory overload, anyone know, year old, high school, autistic people, wondering anyone, anyone tip, sheet bed"
autism,2018-1,2,"people, autism, like, feel, thing, autistic, get, even, know, friend","feel like, autistic people, people autism, high functioning, social anxiety, eye contact, anyone else, year old, thing like, diagnosed autism"
autism,2018-1,3,"autism, child, parent, http, adult, help, would, diagnosis, survey, please","child autism, autism awareness, adult autism, high functioning, functioning autism, people autism, student autism, autism spectrum, would like, need help"
autism,2018-1,4,"son, school, year, old, help, want, therapy, autism, would, child","year old, old son, son diagnosed, autistic son, anyone experience, anyone know, high functioning, would like, school district, diagnosed autism"
schizophrenia,2019-1,0,"schizophrenia, anyone, experience, symptom, know, like, help, people, take, hallucination","anyone else, side effect, mental health, negative symptom, mental illness, http http, anyone know, would like, diagnosed schizophrenia, year ago"
schizophrenia,2019-1,1,"feel, like, people, know, feeling, else, anyone, make, want, thing","feel like, anyone else, make feel, else feel, feeling like, time feel, even though, always feel, seems like, sound like"
schizophrenia,2019-1,2,"voice, hear, hearing, like, head, schizophrenia, sometimes, hallucination, thing, think","hearing voice, voice head, hear voice, auditory hallucination, anyone else, like voice, voice tell, voice hear, sound like, feel like"
schizophrenia,2019-1,3,"know, like, time, get, really, think, would, thing, help, schizophrenia","feel like, year old, mental illness, year ago, even though, diagnosed schizophrenia, mental health, last year, first time, family member"
schizophrenia,2019-1,4,"amp, x200b, http, people, like, help, get, schizophrenia, year, thing","amp x200b, http http, x200b amp, year ago, http amp, x200b http, mental health, feel like, mental illness, schizophrenia amp"
autism,2018-2,0,"amp, http, x200b, autism, autistic, people, game, help, video, research","amp x200b, http http, http amp, video game, amp amp, autistic people, autism spectrum, x200b http, x200b amp, merry christmas"
autism,2018-2,1,"autistic, anyone, like, people, one, school, sensory, else, good, im","anyone else, year old, call autistic, stim toy, sensory overload, brush teeth, high functioning, ca find, instant noodle, trouble understanding"
autism,2018-2,2,"year, get, like, son, thing, time, old, really, help, would","year old, feel like, old son, first time, even though, last night, special interest, last year, anyone else, amp x200b"
autism,2018-2,3,"like, feel, people, know, really, say, autism, even, friend, think","feel like, anyone else, autistic people, high functioning, like people, hard time, else feel, make friend, people know, talk people"
autism,2018-2,4,"autism, child, diagnosed, help, question, adult, test, autistic, would, parent","autism spectrum, child autism, sign autism, diagnosed autism, year old, mental health, adult autism, quotient test, severe autism, autism child"
schizophrenia,2018-2,0,"else, anyone, feel, like, antipsychotic, hallucination, weight, music, feeling, im","anyone else, something else, feel like, effect brain, else feel, sometimes feel, eating much, potent antipsychotic, anybody else, else experience"
schizophrenia,2018-2,1,"schizophrenia, symptom, like, people, anyone, help, know, question, get, someone","negative symptom, god know, feel like, interested hear, would like, question people, cbd oil, schizoaffective bipolar, schizophrenia someone, personality disorder"
schizophrenia,2018-2,2,"voice, like, thought, feel, thing, hear, think, people, head, time","feel like, sound like, hear voice, hearing voice, auditory hallucination, voice head, make sense, like someone, felt like, make feel"
schizophrenia,2018-2,3,"like, know, want, get, time, year, really, help, feel, think","feel like, year ago, mental illness, first time, year old, mental health, psychotic episode, want go, would like, taking med"
schizophrenia,2018-2,4,"amp, x200b, http, mental, schizophrenia, would, illness, health, participant, study","amp x200b, http http, x200b amp, mental health, mental illness, http amp, coping skill, http please, drawn picture, would like"
adhd,2019-2,0,"adderall, xr, taking, day, take, like, feel, ir, dose, medication","adderall xr, taking adderall, adderall ir, take adderall, feel like, side effect, prescribed adderall, anyone else, started taking, first day"
adhd,2019-2,1,"get, like, adhd, time, thing, anyone, work, know, one, day","anyone else, feel like, amp x200b, gon na, every time, anyone know, http http, people adhd, something else, thing like"
adhd,2019-2,2,"adhd, diagnosed, medication, doctor, diagnosis, get, symptom, psychiatrist, help, know","diagnosed adhd, people adhd, adult adhd, feel like, year old, adhd medication, amp x200b, adhd symptom, symptom adhd, get diagnosed"
adhd,2019-2,3,"med, vyvanse, medication, day, taking, effect, take, ritalin, feel, concerta","side effect, feel like, anyone else, take med, started taking, taking med, taking vyvanse, first day, amp x200b, diagnosed adhd"
